pmid,title,abstract,qid,nct_ids,pmcid
32791048,"Sorafenib maintenance in patients with FLT3-ITD acute myeloid leukaemia undergoing allogeneic haematopoietic stem-cell transplantation: an open-label, multicentre, randomised phase 3 trial.",Findings of retrospective studies suggest that sorafenib maintenance post-transplantation might reduce relapse in patients with FLT3 internal tandem duplication (FLT3-ITD) acute myeloid leukaemia unde…,6d09b924e073,NCT02474290,
33616652,Addition of lenalidomide to intensive treatment in younger and middle-aged adults with newly diagnosed AML: the HOVON-SAKK-132 trial.,"Lenalidomide, an antineoplastic and immunomodulatory drug, has therapeutic activity in acute myeloid leukemia (AML), but definitive studies about its therapeutic utility have been lacking. In a phase …",6d09b924e073,,
39113090,Concomitant targeting of FLT3 and SPHK1 exerts synergistic cytotoxicity in FLT3-ITD +  acute myeloid leukemia by inhibiting β-catenin activity via the PP2A-GSK3β axis.,Approximately 25-30% of patients with acute myeloid leukemia (AML) have FMS-like receptor tyrosine kinase-3 (FLT3) mutations that contribute to disease progression and poor prognosis. Prolonged exposu…,6d09b924e073,,
8642852,A prospective randomized trial of idarubicin vs daunorubicin in combination chemotherapy for acute myelogenous leukemia of the age group 55 to 75.,A prospective randomized study was conducted comparing the efficacy and toxicity of two anthracyclines for the treatment of patients with acute myeloid leukemia (AML) between 55 and 75 years. A total …,6d09b924e073,,
32282883,Quizartinib-resistant FLT3-ITD acute myeloid leukemia cells are sensitive to the FLT3-Aurora kinase inhibitor CCT241736.,Internal tandem duplication of FLT3 (FLT3-ITD) is one of the most common somatic mutations in acute myeloid leukemia (AML); it causes constitutive activation of FLT3 kinase and is associated with high…,6d09b924e073,,
19643984,High Id1 expression is associated with poor prognosis in 237 patients with acute myeloid leukemia.,"Inhibitors of differentiation (Id) are a group of dominant inhibitors of basic helix-loop-helix transcriptional factors, which promote excessive proliferation, and also protect cells against drug-indu…",6d09b924e073,,
36695874,Different treatment strategies versus a common standard arm (CSA) in patients with newly diagnosed AML over the age of 60 years: a randomized German inter-group study.,A randomized inter-group trial comparing more intensive treatment strategies to a common standard arm 3 + 7 (CSA) was conducted in patients with non-M3 AML. Untreated patients ≥ 60 years were allocate…,6d09b924e073,,
26923326,Risk-Adapted Approach to HLA-Matched Sibling Hematopoietic Cell Allografting: Impact of Adjusting Conditioning Intensity and Integrating Post-Transplant Therapeutic Interventions.,"Optimizing conditioning and post-transplant intervention may reduce non-relapse mortality and relapse, improving survival after allogeneic hematopoietic cell transplantation (allo-HCT). We used a risk…",6d09b924e073,,
21986636,Prognostic factors for outcomes in allogeneic transplantation for CML in the imatinib era: a CIBMTR analysis.,"Allogeneic hematopoietic SCT is an effective treatment in accelerated (AP) or blast phase (BP) CML. Imatinib (IM) has transient but significant activity in advanced phases of CML, which may permit ear…",6d09b924e073,,
40828961,Prognostic covariates associated with outcomes in patients with NPM1-mutated acute myeloid leukemia.,"NPM1 mutacute myeloid leukemia (AML) patients have greater heterogeneity. However, data on the comprehensive integration of clinical and genetic data in NPM1mutAML patients are limited, especially in …",6d09b924e073,,
39506591,Characteristics and Outcome of FLT3-ITD-Positive Acute Myeloid Leukemia.,"AML patients with FLT3-ITD mutation experience a poor prognosis. Our study evaluated the clini¬cal characteristics, remission, relapse, and clinical outcomes of these patients. We also assessed the ef…",6d09b924e073,,
26220759,Pretransplantation use of the second-generation tyrosine kinase inhibitors has no negative impact on the HCT outcome.,Allogeneic hematopoietic cell transplantation (HCT) was a standard therapy in chronic phase (CP) chronic myeloid leukemia (CML). As a result of the effective therapy with tyrosine kinase inhibitors (T…,6d09b924e073,,
35228711,Gilteritinib enhances graft-versus-leukemia effects against FLT3-ITD mutant leukemia after allogeneic hematopoietic stem cell transplantation.,"Allogeneic hematopoietic stem cell transplantation (allo-SCT) is a potentially curative therapy for FLT3 internal tandem duplication mutant (FLT3-ITD + ) acute myeloid leukemia, but relapse rate is hi…",6d09b924e073,,
35344039,"Preclinical and Pilot Study of Type I FLT3 Tyrosine Kinase Inhibitor, Crenolanib, with Sorafenib in Acute Myeloid Leukemia and FLT3-Internal Tandem Duplication.","To evaluate the safety, activity, and emergence of FLT3-kinase domain (KD) mutations with combination therapy of crenolanib and sorafenib in acute myeloid leukemia (AML) with FLT3-internal tandem dupl…",6d09b924e073,,
18950458,Liposomal daunorubicin versus standard daunorubicin: long term follow-up of the GIMEMA GSI 103 AMLE randomized trial in patients older than 60 years with acute myelogenous leukaemia.,This randomized phase III clinical trial explored the efficacy of DaunoXome (DNX) versus Daunorubicin (DNR) in acute myeloid leukaemia (AML) patients aged >60 years. Three hundred and one AML patients…,6d09b924e073,,
36485102,Transplant for TP53-mutated MDS and AML: because we can or because we should?,TP53 mutations impair the cellular response to genotoxic stress and drive intrinsic resistance to conventional cytotoxic therapies. Clinical outcomes in patients with TP53-mutated myeloid malignancies…,6d09b924e073,,
39589497,Central nervous system relapse after allogeneic HCT in FLT3-mutated AML.,"Central nervous system (CNS) relapse in acute myeloid leukemia (AML) is rare, but prognostically extremely unfavorable and associated with very high mortality rates. Aim of our single-center study was…",6d09b924e073,,
35917188,Murine CAR19 Tregs suppress acute graft-versus-host disease and maintain graft-versus-tumor responses.,"Allogeneic hematopoietic stem cell transplantation (allo-HSCT) efficacy is complicated by graft-versus-host disease (GVHD), a leading cause of morbidity and mortality. Regulatory T cells (Tregs) have …",6d09b924e073,,
35981392,[Hyperthyroidism after Allogeneic Hematopoietic Stem Cell Transplantation].,"To investigate the clinical characteristics, etiology, therapy and outcome of hyperthyroidism after allogeneic hematopoietic stem cell transplantation (HSCT). The clinical data of 7 patients who exper…",6d09b924e073,,
36150050,Enasidenib as maintenance following allogeneic hematopoietic cell transplantation for IDH2-mutated myeloid malignancies.,IDH2 (isocitrate dehydrogenase 2) mutations occur in approximately 15% of patients with acute myeloid leukemia (AML). The IDH2 inhibitor enasidenib was recently approved for IDH2-mutated relapsed or r…,6d09b924e073,NCT03515512,
40779824,Rational combination of homoharringtonine to selectively target FLT3-ITD acute myeloid leukemia through synthetic lethality.,"Homoharringtonine (HHT), a natural product used clinically to treat acute myeloid leukemia (AML) in combination with chemotherapy, induced transient remission in 25 % of unclassified AML patients when…",6d09b924e073,,
16585011,The effect of prior exposure to imatinib on transplant-related mortality.,"Imatinib is an effective treatment for chronic myeloid leukemia (CML) and Philadelphia chromosome-positive (Ph+) acute lymphoblastic leukemia (ALL). However, relapse is common in patients with advance…",6d09b924e073,,
1818368,[Long-term treatment and prognostic factors in adult acute myeloblastic leukemia. Experience of the INNSZ group Puebla-Monterrey-Mexico)].,The results of the treatment in a group of 43 adult patients with acute myelogenous leukemia (AML) are analyzed. All patients were induced to remission with a 7/3 schedule: cytarabine in continuous in…,6d09b924e073,,
26304085,[Efficacy comparison between Ph⁺ ALL patients treated with chemotherapyplus tyrosine kinase inhibitors followed by allo-HSCT and Ph-ALL patients with allo-HSCT: a case control study from a single center].,To compare the efficacy of the Ph⁺ acute lymphoblastic leukemia (ALL)patients treated with combination of tyrosine kinase inhibitors (TKI)and chemotherapy followed by allogeneic hematopoietic stem cel…,6d09b924e073,,
34424108,Safety of FLT3 inhibitors in patients with acute myeloid leukemia.,"Introduction:  Acute myeloblastic leukemia (AML) is the most frequent type of acute leukemia in adults with an incidence of 4.2 cases per 100,000 inhabitants and poor 5-year survival. Patients with mu…",6d09b924e073,,
16330096,Chronic myeloid leukemia after treatment of lymphoid malignancies: response to imatinib mesylate and favorable outcomes in three patients.,"Recent improved treatments for lymphoid malignancies produce more long-term survivors, yet increase the risk for secondary malignancies. Therapy-related myelodysplasia and acute myeloid leukemia are w…",6d09b924e073,,
