pmid,title,abstract,qid,nct_ids,pmcid
35861214,Results of Multicenter Phase II Study With Imatinib Mesylate in Allogeneic Recipients With Steroid-Refractory Chronic GVHD.,"In this multicenter phase II study, we evaluated the safety and efficacy of imatinib in patients with steroid-resistant chronic graft-versus-host disease (cGVHD) and evaluated the quality of life (QOL…",6d09b924e073,,
29179634,Azacytidine in combination with tyrosine kinase inhibitors induced durable responses in patients with advanced phase chronic myelogenous leukemia.,"Although the tyrosine kinase inhibitor (TKI) era has brought great improvement in outcome in chronic myelogenous leukemia (CML), prognosis of accelerated phase or myeloid blast crisis patients or of d…",6d09b924e073,,
40577201,Post-transplant sorafenib effectively prevents relapse in FLT3-mutated acute myeloid leukemia.,Almost 50% of patients with FLT3-ITD AML relapse despite undergoing allogeneic hematopoietic stem cell transplantation (HSCT). FLT-3 inhibitors (FLT3i) can be used in a post-HSCT setting as a relapse …,6d09b924e073,,
26999641,Aberrant activation of the PI3K/mTOR pathway promotes resistance to sorafenib in AML.,"Therapy directed against oncogenic FLT3 has been shown to induce response in patients with acute myeloid leukemia (AML), but these responses are almost always transient. To address the mechanism of FL…",6d09b924e073,,
38548962,Management and outcome of patients with chronic myeloid leukemia in blast phase in the tyrosine kinase inhibitor era - analysis of the European LeukemiaNet Blast Phase Registry.,Blast phase (BP) of chronic myeloid leukemia (CML) still represents an unmet clinical need with a dismal prognosis. Due to the rarity of the condition and the heterogeneity of the biology and clinical…,6d09b924e073,,
36372140,Ruxolitinib on acute graft-versus-host disease prophylaxis after modified donor lymphocyte infusion.,To evaluate the effectiveness of ruxolitinib on acute graft-versus-host disease (aGVHD) prophylaxis and its impact on graft-versus-leukemia (GVL) effect in patients after modified donor lymphocyte inf…,6d09b924e073,,
39362494,"N-803, an IL-15 Superagonist Complex as Maintenance Therapy After Allogeneic Donor Stem Cell Transplant for Acute Myeloid Leukemia or Myelodysplastic Syndrome; A Phase 2 Trial.",Maintenance therapy may improve natural killer (NK) cell surveillance after allogeneic donor hematopoietic cell transplant (HCT) for myeloid malignancies and represents a potential approach to improve…,6d09b924e073,,
34334272,A case of inflammatory myopathy in graft vs host disease - A potential role for ibrutinib.,"Myositis is a known complication of chronic graft-vs-host disease (cGVHD) following allogeneic haematopoietic stem cell transplantation, but can be difficult to diagnose and manage. We present the cas…",6d09b924e073,,
27812545,Low-dose IL-2 selectively activates subsets of CD4 +  Tregs and NK cells.,CD4 +  regulatory T cells (CD4Tregs) play a critical role in the maintenance of immune tolerance and prevention of chronic graft-versus-host disease (GVHD) after allogeneic hematopoietic stem cell tra…,6d09b924e073,,
33831397,Homoharringtonine synergizes with quizartinib in FLT3-ITD acute myeloid leukemia by targeting FLT3-AKT-c-Myc pathway.,"Acute myeloid leukemia (AML) with FLT3 internal tandem duplication (FLT3-ITD) has a dismal prognosis. FLT3 inhibitors have been developed to treat patients with FLT3-ITD AML; however, when used alone,…",6d09b924e073,,
32791048,"Sorafenib maintenance in patients with FLT3-ITD acute myeloid leukaemia undergoing allogeneic haematopoietic stem-cell transplantation: an open-label, multicentre, randomised phase 3 trial.",Findings of retrospective studies suggest that sorafenib maintenance post-transplantation might reduce relapse in patients with FLT3 internal tandem duplication (FLT3-ITD) acute myeloid leukaemia unde…,6d09b924e073,NCT02474290,
39113090,Concomitant targeting of FLT3 and SPHK1 exerts synergistic cytotoxicity in FLT3-ITD +  acute myeloid leukemia by inhibiting β-catenin activity via the PP2A-GSK3β axis.,Approximately 25-30% of patients with acute myeloid leukemia (AML) have FMS-like receptor tyrosine kinase-3 (FLT3) mutations that contribute to disease progression and poor prognosis. Prolonged exposu…,6d09b924e073,,
41070588,Clinical outcomes of allogeneic cell transplantation for patients with chronic myeloid leukemia.,Allogeneic hematopoietic cell transplantation (allo-HCT) remains a key treatment for patients with chronic myeloid leukemia (CML) in blast phase (CML-BP) or tyrosine kinase inhibitor (TKI)-resistant c…,6d09b924e073,,
39506591,Characteristics and Outcome of FLT3-ITD-Positive Acute Myeloid Leukemia.,"AML patients with FLT3-ITD mutation experience a poor prognosis. Our study evaluated the clini¬cal characteristics, remission, relapse, and clinical outcomes of these patients. We also assessed the ef…",6d09b924e073,,
21871246,Late relapses following high-dose autologous stem cell transplantation (HD-ASCT) for Hodgkin's lymphoma (HL) in the ABVD therapeutic era.,Salvage chemotherapy followed by high-dose autologous stem cell transplantation (HD-ASCT) is the standard of care for patients who have relapsed or refractory Hodgkin's lymphoma (HL). Few trials have …,6d09b924e073,,
39589497,Central nervous system relapse after allogeneic HCT in FLT3-mutated AML.,"Central nervous system (CNS) relapse in acute myeloid leukemia (AML) is rare, but prognostically extremely unfavorable and associated with very high mortality rates. Aim of our single-center study was…",6d09b924e073,,
35228711,Gilteritinib enhances graft-versus-leukemia effects against FLT3-ITD mutant leukemia after allogeneic hematopoietic stem cell transplantation.,"Allogeneic hematopoietic stem cell transplantation (allo-SCT) is a potentially curative therapy for FLT3 internal tandem duplication mutant (FLT3-ITD + ) acute myeloid leukemia, but relapse rate is hi…",6d09b924e073,,
35231083,How I treat with maintenance therapy after allogeneic HCT.,Disease relapse is the leading cause of failure for patients receiving allogeneic hematopoietic cell transplantation (allo-HCT). Maintenance therapy administered after allo-HCT is a promising strategy…,6d09b924e073,,
24040278,Reasons for non-completion of health related quality of life evaluations in pediatric acute myeloid leukemia: a report from the Children's Oncology Group.,Health related quality of life (HRQL) assessments during therapy for pediatric cancer are important. The objective of this study was to describe reasons for failure to provide HRQL assessments during …,6d09b924e073,,
35917188,Murine CAR19 Tregs suppress acute graft-versus-host disease and maintain graft-versus-tumor responses.,"Allogeneic hematopoietic stem cell transplantation (allo-HSCT) efficacy is complicated by graft-versus-host disease (GVHD), a leading cause of morbidity and mortality. Regulatory T cells (Tregs) have …",6d09b924e073,,
35981392,[Hyperthyroidism after Allogeneic Hematopoietic Stem Cell Transplantation].,"To investigate the clinical characteristics, etiology, therapy and outcome of hyperthyroidism after allogeneic hematopoietic stem cell transplantation (HSCT). The clinical data of 7 patients who exper…",6d09b924e073,,
33616652,Addition of lenalidomide to intensive treatment in younger and middle-aged adults with newly diagnosed AML: the HOVON-SAKK-132 trial.,"Lenalidomide, an antineoplastic and immunomodulatory drug, has therapeutic activity in acute myeloid leukemia (AML), but definitive studies about its therapeutic utility have been lacking. In a phase …",6d09b924e073,,
36485102,Transplant for TP53-mutated MDS and AML: because we can or because we should?,TP53 mutations impair the cellular response to genotoxic stress and drive intrinsic resistance to conventional cytotoxic therapies. Clinical outcomes in patients with TP53-mutated myeloid malignancies…,6d09b924e073,,
40779824,Rational combination of homoharringtonine to selectively target FLT3-ITD acute myeloid leukemia through synthetic lethality.,"Homoharringtonine (HHT), a natural product used clinically to treat acute myeloid leukemia (AML) in combination with chemotherapy, induced transient remission in 25 % of unclassified AML patients when…",6d09b924e073,,
19129849,Differential expression of SMAD3 transcripts is not regulated by cis-acting genetic elements but has a gender specificity.,"As a key component of the transforming growth factor-beta (TGF-beta) pathway, SMAD3 plays an essential role in development and maintenance of self-tolerance. Furthermore, a recent study based on gene-…",6d09b924e073,,
34424108,Safety of FLT3 inhibitors in patients with acute myeloid leukemia.,"Introduction:  Acute myeloblastic leukemia (AML) is the most frequent type of acute leukemia in adults with an incidence of 4.2 cases per 100,000 inhabitants and poor 5-year survival. Patients with mu…",6d09b924e073,,
39740295,Clonal GZMK + CD8 +  T cells are identified as a hallmark of the pathogenesis of cGVHD-induced bronchiolitis obliterans syndrome after allogeneic hematopoietic stem cell transplantation.,Bronchiolitis obliterans syndrome (BOS) is one of the most devastating outcomes of chronic graft-versus-host disease (cGVHD) after allogeneic hematopoietic stem cell transplantation (allo-HSCT). This …,6d09b924e073,,
